ToAllowXAxisZoom,Relationship Measure,R2,Correlation,Abosolute Correlation Value
303,Percentage of cancers diagnosed at stages 1 and 2,0.197,-0.443,0.443
304,"Genital warts diagnostic rate per 100,000",0.196,-0.443,0.443
305,Smoking prevalence in adults (18+) - never smoked (GPPS),0.197,-0.444,0.444
306,"Mycoplasma genitalium diagnostic rate per 100,000",0.2,-0.447,0.447
307,"HIV diagnosed prevalence rate per 1,000",0.205,-0.452,0.452
308,Average Attainment 8 Score among children eligible for Free School Meals (FSM),0.204,-0.452,0.452
309,"New STI diagnoses (excluding chlamydia aged under 25) per 100,000",0.205,-0.453,0.453
310,Percentage of adults cycling for travel at least three days per week,0.205,-0.453,0.453
311,"STI testing rate (exclude chlamydia aged under 25) per 100,000",0.212,-0.461,0.461
312,Proportion of the population meeting the recommended 5-a-day on a usual day (adults),0.214,-0.462,0.462
313,Percentage of population whose ethnicity is not White UK,0.228,-0.478,0.478
314,Educational attainment (5 or more GCSEs): % of all children,0.23,-0.479,0.479
315,Households with overcrowding based on overall room occupancy levels,0.267,-0.516,0.516
316,"Migrant GP registrations: rate per 1,000 population",0.266,-0.516,0.516
317,Determining PrEP need,0.291,-0.539,0.539
318,Percentage of adults walking for travel at least three days per week,0.293,-0.541,0.541
319,Average weekly earnings,0.341,-0.584,0.584
320,Killed and seriously injured (KSI) casualties on Englands roads,0.395,-0.629,0.629
321,Affordability of home ownership,0.497,-0.705,0.705
322,Babys first feed breastmilk,0.532,-0.729,0.729